{
  "$schema": "https://json-schema.org/draft/2020-12/schema",
  "$id": "https://github.com/forgefabrik/apw-rs/blob/main/features.registry.schema.json",
  "title": "apw-rs Feature Registry",
  "description": "Machine-readable source of truth for what is being ported from each upstream project, into which apw-* crate, in which milestone, and at what status. FEATURES.md is generated FROM this file; this file is never generated. The four tool crates (feature-guardian, feature-md, feature-harvester, feature-graph) read and write this file.",
  "type": "object",
  "required": ["schema_version", "features"],
  "additionalProperties": false,
  "properties": {
    "schema_version": {
      "type": "string",
      "pattern": "^\\d+\\.\\d+\\.\\d+$",
      "description": "Semver of this registry schema. Bump on breaking changes to the Feature shape."
    },
    "registry_revision": {
      "type": "integer",
      "minimum": 0,
      "description": "Monotonically increasing revision number for the registry content. Bumped on every commit that adds/removes/changes a feature. Used by feature-md to detect when FEATURES.md is stale."
    },
    "generated_at": {
      "type": "string",
      "format": "date-time",
      "description": "ISO-8601 timestamp of last registry update. Updated by maintainers, not tools."
    },
    "sources": {
      "type": "array",
      "description": "Upstream repos catalogued in the registry. Drives feature-harvester and provides provenance.",
      "items": { "$ref": "#/$defs/Source" }
    },
    "features": {
      "type": "array",
      "items": { "$ref": "#/$defs/Feature" }
    }
  },
  "$defs": {
    "Source": {
      "type": "object",
      "required": ["id", "repo"],
      "additionalProperties": false,
      "properties": {
        "id": { "type": "string", "description": "Stable source identifier, e.g. 'agent-bigbrother'." },
        "repo": { "type": "string", "description": "GitHub owner/repo, e.g. 'forgefabrik/agent-bigbrother'." },
        "url": { "type": "string", "format": "uri" },
        "role": { "type": "string", "description": "Why this source is being ported." },
        "license": { "type": "string" }
      }
    },
    "Feature": {
      "type": "object",
      "required": ["id", "name", "phase", "milestone", "status"],
      "additionalProperties": false,
      "properties": {
        "id": {
          "type": "string",
          "pattern": "^\\d+\\.\\d+\\.\\d+$",
          "description": "Stable feature identifier, e.g. '3.1.6'. Format: section.subsection.sequence. Re-numbering breaks diff readability, so never renumber."
        },
        "name": { "type": "string", "minLength": 1, "description": "Short, human-readable feature name." },
        "phase": {
          "type": "string",
          "enum": ["phase-1", "phase-2"],
          "description": "phase-1 = Visual Office Foundation + Living Office Simulation (current build, M0-M5). phase-2 = Economy & Multi-Role Roadmap (post-office)."
        },
        "milestone": {
          "type": "string",
          "enum": ["M0", "M1", "M2", "M3", "M4", "M5", "M6+"],
          "description": "Milestone this feature lands in. M6+ is for forward-looking work with no committed milestone yet."
        },
        "status": {
          "type": "string",
          "enum": ["done", "porting", "planned", "deferred", "not-adopted"],
          "description": "done = feature exists in apw-rs. porting = actively in progress for a milestone. planned = on the roadmap for a milestone but not started. deferred = recognized but explicitly out of scope. not-adopted = exists upstream but apw-rs has decided not to take it."
        },
        "source_id": {
          "type": "string",
          "description": "Foreign key to sources[].id. Required unless source == 'apw-rs' (cross-cutting)."
        },
        "from": {
          "type": "object",
          "description": "Where the feature comes from upstream.",
          "additionalProperties": false,
          "properties": {
            "path": { "type": "string", "description": "File path in the upstream repo, e.g. 'kernel/event-core.mjs'." },
            "kind": {
              "type": "string",
              "enum": ["file", "module", "endpoint", "block", "section"],
              "description": "file = a single source file. module = a directory of files. endpoint = a URL/route. block = a paragraph/section in a file. section = a top-level section in a doc."
            },
            "url": { "type": "string", "format": "uri", "description": "Deep link to the upstream file, e.g. on GitHub." },
            "line": { "type": "integer", "minimum": 1 }
          }
        },
        "to": {
          "type": "object",
          "description": "Where the feature lands in apw-rs.",
          "additionalProperties": false,
          "properties": {
            "crate": { "type": "string", "description": "Crate name, e.g. 'apw-kernel'. Must match a workspace member or be a documented future crate." },
            "module": { "type": "string", "description": "Module path, e.g. 'apw_kernel::event_core'." },
            "path": { "type": "string", "description": "Path in the apw-rs tree, e.g. 'crates/apw-kernel/src/event_core.rs'." }
          }
        },
        "tags": {
          "type": "array",
          "items": { "type": "string" },
          "description": "Free-form tags for filtering and searching, e.g. ['kernel', 'replay', 'trust']."
        },
        "depends_on": {
          "type": "array",
          "items": { "type": "string", "pattern": "^\\d+\\.\\d+\\.\\d+$" },
          "description": "Feature IDs this feature depends on. Drives the dependency graph and the critical-path computation."
        },
        "evidence": {
          "type": "object",
          "additionalProperties": false,
          "properties": {
            "doc_url": { "type": "string", "format": "uri" },
            "doc_line": { "type": "integer", "minimum": 1 },
            "rationale": { "type": "string", "description": "Why this feature is in this phase and at this status." }
          }
        },
        "notes": {
          "type": "string",
          "description": "Free-form notes. Use for forward-compat placeholders, known limitations, design references."
        }
      }
    }
  }
}
