{
  "schema_version": "1.0.0",
  "registry_revision": 2,
  "generated_at": "2026-06-06T01:00:00Z",
  "sources": [
    {
      "id": "agent-bigbrother",
      "repo": "forgefabrik/agent-bigbrother",
      "url": "https://github.com/forgefabrik/agent-bigbrother",
      "role": "ForgeFabrik Agent OS v0.2a — the concrete kernel/engine/webui implementation. Provides the bulk of the feature surface.",
      "license": "MIT"
    },
    {
      "id": "agent-os",
      "repo": "forgefabrik/forgefabrik-agent-os",
      "url": "https://github.com/forgefabrik/forgefabrik-agent-os",
      "role": "Architectural spec for the same system (L0–L5, docker stack, TAP layer, control plane UI). Drives the design spec.",
      "license": "MIT"
    },
    {
      "id": "opencode-manager",
      "repo": "chriswritescode-dev/opencode-manager",
      "url": "https://github.com/chriswritescode-dev/opencode-manager",
      "role": "Mobile-first PWA control plane for OpenCode agents. Drives the manager/web feature surface (M2, M5).",
      "license": "MIT"
    },
    {
      "id": "pixtuoid",
      "repo": "IvanWng97/pixtuoid",
      "url": "https://github.com/IvanWng97/pixtuoid",
      "role": "Rust terminal pixel-art office for AI agents. Drives apw-office TUI (M4) and the apw-hook shim pattern. The only pure-Rust source project.",
      "license": "MIT"
    },
    {
      "id": "agentroom",
      "repo": "liuyixin-louis/agentroom",
      "url": "https://github.com/liuyixin-louis/agentroom",
      "role": "Visual pixel-art layer for AgentRoom — Canvas 2D + Tauri v2 + CASS search backend. Reference for the visual surface; the React/Canvas code is a UX inspiration, not a port target (we use Dioxus fullstack in apw-gateway).",
      "license": "MIT"
    },
    {
      "id": "apw-rs",
      "repo": "forgefabrik/apw-rs",
      "url": "https://github.com/forgefabrik/apw-rs",
      "role": "This repository. Cross-cutting features (policies, boundaries, governance) are catalogued with source_id=apw-rs.",
      "license": "MIT"
    },
    {
      "id": "lmstudio",
      "repo": "lmstudio-ai/lms",
      "url": "https://lmstudio.ai/docs/typescript/plugins",
      "role": "LM Studio TypeScript plugin SDK (@lmstudio/sdk). The CEO's cognitive layer runs on this — LMStudioClient + tool() + model.act() turn an LLM into an orchestrator with a typed tool surface backed by apw-kernel.",
      "license": "Apache-2.0"
    }
  ],
  "features": [
    {
      "id": "1.0.0",
      "name": "Hash-chained event log (event-core)",
      "phase": "phase-1",
      "milestone": "M1",
      "status": "planned",
      "source_id": "agent-bigbrother",
      "from": { "path": "kernel/event-core.mjs", "kind": "file", "url": "https://github.com/forgefabrik/agent-bigbrother/blob/main/kernel/event-core.mjs" },
      "to": { "crate": "apw-kernel", "module": "apw_kernel::event_core", "path": "crates/apw-kernel/src/event_core.rs" },
      "tags": ["kernel", "events", "replay"],
      "depends_on": ["1.0.1"]
    },
    {
      "id": "1.0.1",
      "name": "Canonical JSON + SHA-256 (canonicalizer)",
      "phase": "phase-1",
      "milestone": "M1",
      "status": "planned",
      "source_id": "agent-bigbrother",
      "from": { "path": "kernel/canonicalizer.mjs", "kind": "file" },
      "to": { "crate": "apw-protocol", "module": "apw_protocol::canonical", "path": "crates/apw-protocol/src/canonical.rs" },
      "tags": ["kernel", "canonical", "hashing"],
      "depends_on": []
    },
    {
      "id": "1.0.2",
      "name": "6-component execution trace (tracer)",
      "phase": "phase-1",
      "milestone": "M1",
      "status": "planned",
      "source_id": "agent-bigbrother",
      "from": { "path": "kernel/tracer.mjs", "kind": "file" },
      "to": { "crate": "apw-kernel", "module": "apw_kernel::tracer" },
      "tags": ["kernel", "tracing"]
    },
    {
      "id": "1.0.3",
      "name": "Contract freezer (8 + pure kinds)",
      "phase": "phase-1",
      "milestone": "M1",
      "status": "planned",
      "source_id": "agent-bigbrother",
      "from": { "path": "kernel/freezer.mjs", "kind": "file" },
      "to": { "crate": "apw-kernel", "module": "apw_kernel::freezer" },
      "tags": ["kernel", "freezer", "contracts"]
    },
    {
      "id": "1.0.4",
      "name": "Decision-graph algebra",
      "phase": "phase-1",
      "milestone": "M1",
      "status": "planned",
      "source_id": "agent-bigbrother",
      "from": { "path": "kernel/algebra.mjs", "kind": "file" },
      "to": { "crate": "apw-kernel", "module": "apw_kernel::algebra" },
      "tags": ["kernel", "algebra", "decisions"]
    },
    {
      "id": "1.0.5",
      "name": "Deterministic replay engine",
      "phase": "phase-1",
      "milestone": "M1",
      "status": "planned",
      "source_id": "agent-bigbrother",
      "from": { "path": "kernel/replay.mjs", "kind": "file" },
      "to": { "crate": "apw-kernel", "module": "apw_kernel::replay" },
      "tags": ["kernel", "replay"],
      "depends_on": ["1.0.0", "1.0.1"]
    },
    {
      "id": "1.0.6",
      "name": "Point-in-time world snapshots",
      "phase": "phase-1",
      "milestone": "M1",
      "status": "planned",
      "source_id": "agent-bigbrother",
      "from": { "path": "kernel/snapshot.mjs", "kind": "file" },
      "to": { "crate": "apw-kernel", "module": "apw_kernel::snapshot" },
      "tags": ["kernel", "snapshot"]
    },
    {
      "id": "1.0.7",
      "name": "Trust report + integrity verifier",
      "phase": "phase-1",
      "milestone": "M1",
      "status": "planned",
      "source_id": "agent-bigbrother",
      "from": { "path": "kernel/trust-report.mjs", "kind": "file" },
      "to": { "crate": "apw-kernel", "module": "apw_kernel::trust" },
      "tags": ["kernel", "trust", "replay"],
      "depends_on": ["1.0.5"]
    },
    {
      "id": "1.0.8",
      "name": "Storage event middleware",
      "phase": "phase-1",
      "milestone": "M1",
      "status": "planned",
      "source_id": "agent-bigbrother",
      "from": { "path": "kernel/storage-events.mjs", "kind": "file" },
      "to": { "crate": "apw-kernel", "module": "apw_kernel::storage_events" },
      "tags": ["kernel", "persistence"]
    },
    {
      "id": "1.0.9",
      "name": "Runtime snapshot aggregator",
      "phase": "phase-1",
      "milestone": "M2",
      "status": "planned",
      "source_id": "agent-bigbrother",
      "from": { "path": "kernel/runtime_snapshot.mjs", "kind": "file" },
      "to": { "crate": "apw-server", "module": "apw_server::runtime_snapshot" },
      "tags": ["server", "snapshot", "api"]
    },
    {
      "id": "1.0.10",
      "name": "Pixel-agent projection (avatar, badges, workstation)",
      "phase": "phase-1",
      "milestone": "M4",
      "status": "planned",
      "source_id": "agent-bigbrother",
      "from": { "path": "kernel/agent_projection.mjs", "kind": "file" },
      "to": { "crate": "apw-pixel-plugin", "module": "apw_pixel_plugin::projection::agents" },
      "tags": ["pixel", "projection", "office"]
    },
    {
      "id": "1.0.11",
      "name": "Forge tower 4-floor × 3-room projection",
      "phase": "phase-1",
      "milestone": "M4",
      "status": "planned",
      "source_id": "agent-bigbrother",
      "from": { "path": "kernel/forge_tower.mjs", "kind": "file" },
      "to": { "crate": "apw-pixel-plugin", "module": "apw_pixel_plugin::projection::tower" },
      "tags": ["pixel", "projection", "tower", "office"]
    },
    {
      "id": "1.0.12",
      "name": "Speech-bubble conversation threads",
      "phase": "phase-1",
      "milestone": "M4",
      "status": "planned",
      "source_id": "agent-bigbrother",
      "from": { "path": "kernel/conversations (in runtime_snapshot.mjs)", "kind": "block" },
      "to": { "crate": "apw-pixel-plugin", "module": "apw_pixel_plugin::projection::conversations" },
      "tags": ["pixel", "projection", "speech"]
    },
    {
      "id": "1.0.13",
      "name": "Sprite loader + manifest resolver (read-only)",
      "phase": "phase-1",
      "milestone": "M4",
      "status": "planned",
      "source_id": "agent-bigbrother",
      "from": { "path": "kernel/sprite_loader.mjs", "kind": "file" },
      "to": { "crate": "apw-pixel-plugin", "module": "apw_pixel_plugin::SpriteLoader" },
      "tags": ["pixel", "sprites", "loader"]
    },
    {
      "id": "2.0.0",
      "name": "LM Studio HTTP bridge (kernel-side)",
      "phase": "phase-1",
      "milestone": "M2",
      "status": "planned",
      "source_id": "agent-bigbrother",
      "from": { "path": "kernel/llmstudio.mjs", "kind": "file" },
      "to": { "crate": "apw-engine", "module": "apw_engine::llm::LmStudioBridge" },
      "tags": ["kernel", "llm", "bridge"]
    },
    {
      "id": "2.0.1",
      "name": "Skills-lock loader",
      "phase": "phase-1",
      "milestone": "M2",
      "status": "planned",
      "source_id": "agent-bigbrother",
      "from": { "path": "kernel/skills-loader.mjs", "kind": "file" },
      "to": { "crate": "apw-kernel", "module": "apw_kernel::skills_lock" },
      "tags": ["kernel", "skills"]
    },
    {
      "id": "2.0.2",
      "name": "Skill dispatcher + plugin transport rule",
      "phase": "phase-1",
      "milestone": "M2",
      "status": "planned",
      "source_id": "agent-bigbrother",
      "from": { "path": "kernel/skill-dispatcher.mjs", "kind": "file" },
      "to": { "crate": "apw-kernel", "module": "apw_kernel::skill_dispatcher" },
      "tags": ["kernel", "skills", "dispatch"]
    },
    {
      "id": "2.0.3",
      "name": "Sandbox executor (shell / docker / git_commit / code_edit)",
      "phase": "phase-1",
      "milestone": "M2",
      "status": "planned",
      "source_id": "agent-bigbrother",
      "from": { "path": "kernel/sandbox-executor.mjs", "kind": "file" },
      "to": { "crate": "apw-engine", "module": "apw_engine::sandbox" },
      "tags": ["engine", "sandbox", "execution"]
    },
    {
      "id": "2.0.4",
      "name": "HTTP server hosting webui + REST",